<?xml version="1.0" encoding="UTF-8"?>

<persoane xmlns:xsi="http://www.w3.org/2001/XMLSchema-instance"
          xsi:noNamespaceSchemaLocation="persoane.xsd">
    <persoana id = "1">
        <nume>Hepburn</nume>
        <prenume>Audrey</prenume>
        <varsta>63</varsta>
        <adresa>
            <strada>La Paisible</strada>
            <numar>1</numar>
            <localitate>Tolochenaz</localitate>
            <judet>Vaud</judet>
            <tara>Elveția</tara>
        </adresa>
        <job>
            <companie>UNICEF</companie>
            <rol>Goodwill Ambassador</rol>
        </job>
    </persoana>
    <persoana id = "2">
        <nume>Grant</nume>
        <prenume>Elizabeth Woolridge</prenume>
        <varsta>39</varsta>
        <adresa>
            <strada>Ocean Avenue</strada>
            <numar>45</numar>
            <localitate>Malibu</localitate>
            <judet>California</judet>
            <tara>Statele Unite ale Americii</tara>
        </adresa>
        <job>
            <companie>Interscope Records</companie>
            <rol>Cântăreță</rol>
        </job>
    </persoana>
    <persoana id = "3">
        <nume>Grande</nume>
        <prenume>Ariana</prenume>
        <varsta>31</varsta>
        <adresa>
            <strada>Boca Raton Blvd</strada>
            <numar>777</numar>
            <localitate>Boca Raton</localitate>
            <judet>Florida</judet>
            <tara>Statele Unite ale Americii</tara>
        </adresa>
        <job>
            <companie>r.e.m. beauty</companie>
            <rol>CEO</rol>
        </job>
    </persoana>
</persoane>
